review_id,date,user_name,score,thumbs_up,content,review_created_version,theme
5d572050-67be-477f-9f32-7dcd0d514798,2025-12-02,Anonymous User,4,0,"Good app for Mutual Funds, but investing directly on stocks is not as good as INDmoney. Hope we can link our external stocks here too like we can with our mutual funds.",17.97.2,Missing or Requested Features
6409b3b8-06e6-4928-8a56-1b554e94e46a,2025-12-01,Anonymous User,3,0,"There is no feature of "" Profit / Loss in Percentage"" for open positions. Only amount is shown.....",17.97.2,Technical Glitches & Performance Issues
134b0841-55c2-4aac-82a2-1294ca325b17,2025-12-01,Anonymous User,1,0,"4h charts and some small TFs are not visible fully, only a partial area is working in charts",17.97.2,User Interface & Experience (UI/UX)
f1801f3b-6869-422f-ac7c-52507c30d432,2025-12-01,Anonymous User,5,0,it would be a good addition to this app if we can calculate how much shares we need to buy to make the average price near to the market value.,17.97.2,User Interface & Experience (UI/UX)
1768a007-be43-409c-821e-e48226bd4a95,2025-12-01,Anonymous User,2,1,There is very unexpected from the side of grows company. They will start charge for edit personal details in grow app.,17.97.2,High Charges & Brokerage Concerns
57fa6925-541e-4322-8211-9f2215378e84,2025-12-01,Anonymous User,1,0,good app but sells my data to 3rd party stock brokers,17.96.7,User Interface & Experience (UI/UX)
88716f74-481b-4ed5-8fb1-ce32ada87834,2025-12-01,Anonymous User,4,3,"groww app is showing wrong candle of index chart .Ex, when market up side showing red candle in movementum and when market down side movementum showing green candle. that's wrong indicate. not true. please improve , I notised this last 6 month, fourth time's. if you want screenshot i will share to you cantact me.",17.94.1,Customer Support & Service Quality
a3f75ac8-10ee-4f22-bd4e-093fbcf1fcf9,2025-12-01,Anonymous User,5,0,this app is nice but feature complicated for beginners advance understand please. thanks 👍🏻,17.97.2,Technical Glitches & Performance Issues
e6d1af76-d048-461f-9b00-f6ac19a6619d,2025-12-01,Anonymous User,1,17,too much CHARGES and TAXES. if you get 100rs profit 50-60rs will be taxes while buying and for maintaining and for even selling the stocks.! worst experience I have been using thinking getting profits for trading but everything is loss when you use trade buy sell stocks through Grow.! advice you to not use grow. better there are a lot of platforms! compare others but don't come to grow. even upstox is also useless it charges montly and yearly charges. better go for zeroda.,17.97.2,User Interface & Experience (UI/UX)
371d6d33-0275-4f27-b745-557b64f031af,2025-12-01,Anonymous User,3,1,application glith shows something and the actual result is different. Trade gets closed and the screen shows a strange amount which was not there during trade.,17.97.2,User Interface & Experience (UI/UX)
3f906e16-5466-48ab-9b34-9148c3c1c88f,2025-11-30,Anonymous User,1,1,"Don't Download, If you don't have knowledge then everything is a scam in this, the same thing has happened with me, the balance is going into automatic minus, it is a fraud.",17.97.2,Customer Support & Service Quality
bb95d3cf-ff4a-47f9-a647-eeff7c3a54ab,2025-11-30,Anonymous User,5,8,"I am using this app from last many years, it is very easy to use and the service is also good.",17.96.7,User Interface & Experience (UI/UX)
1fbc9fb6-821a-48e9-80b9-298ceaefedaf,2025-11-30,Anonymous User,5,1,excellent app I have only one issue with mf investment many times I place mf redemption or investment orders but after I realise that I placed wrong amount or doesn't need that redemption then I can not cancel mf order like stock order,17.97.2,Missing or Requested Features
952ee97d-4d7a-4038-ae2f-14f525d806c6,2025-11-30,Anonymous User,5,63,this option chain is not better..so please give old option chain with change in oi and total oi.. there is no proper dispay in new option chain..so please change it. Thanka for adding new feature of oi in groww.ita superb..and u should display on mobile apps because of so much user trading through mobile..if u can do this..pls see oi on mobile groww apps..,17.98.0,Customer Support & Service Quality
ec247d3e-3cbb-43d8-a159-8831e85f6ed3,2025-11-30,Anonymous User,4,3,the graphs keep getting stuck . Fix this issue as soon as possible. Edit: This problem has been fixed so no issues. Everything else is good,17.96.7,User Interface & Experience (UI/UX)
474881b8-a35a-4cc0-8d8e-ad6d9b7f4075,2025-11-29,Anonymous User,4,0,"its a Feedback 🟡 groww team please bring SLBM (stock renting and borrowing mechanism) feature , its a high time to bring this Feature",17.97.2,Customer Support & Service Quality
83bf7236-5379-477a-ae55-497fa7bb9eb4,2025-11-29,Anonymous User,5,3,good app and very fast response.. good customer care support,17.97.2,Customer Support & Service Quality
3ca56d58-c988-45c1-8a46-b4cb375f3159,2025-11-29,Anonymous User,1,1,Share And Personal And Photos data not Secure in This application Very poor Application,17.97.2,User Interface & Experience (UI/UX)
80dee0e4-c3ac-4030-97f7-ef67edcdad38,2025-11-29,Anonymous User,2,0,I have deposited rupees 200 hundred for purchase Bank of Baroda shares but I lost my 200 rupees how can I get my this 200 rupees in my bank account your email ID is not working properly I am not able to send you My complaint,17.97.2,User Interface & Experience (UI/UX)
83cca9c7-9a7f-4fe8-8d41-c5975e236d5d,2025-11-29,Anonymous User,5,64,"I've been investing in this app for more than three years. I've earned and lost money in the market, and it's taught me a lot. However, investing with Groww has helped me grow. I'll rate trust 10/10.",17.97.2,Technical Glitches & Performance Issues
cd3607bd-cab3-45ef-80c3-0af950a492cd,2025-11-29,Anonymous User,2,145,"The app is good, but the call center experience isn’t. I prefer your AI Voice Assistant because it solves my problem in just 30–50 seconds. In a human call, I first have to enter my date of birth, then select options based on my issue, and only after that do I get connected to a representative. The whole process takes around 7–8 minutes. The speed should be faster. In the end, my problem was solved. Thank you.",17.96.6,Customer Support & Service Quality
7ece759b-7a4b-47c3-9f20-fbf5710931ed,2025-11-29,Anonymous User,5,327,it's all good.... pls avail the SL and Target trailing on the chart itself.. coz whenever I go in profit I need to trail the SL n target... and it's very irritating to go through the whole process to be done in a manual way. so pls add that feature.. I need all the features on the chart either it's sl target or dispose the position. it would be a good relief. pls look into this .,17.97.2,Technical Glitches & Performance Issues
6f94bce8-7cc7-4df0-aa57-db54a0909233,2025-11-29,Anonymous User,5,0,I really like grow app and team to helps every time grow team ready for all,17.97.2,High Charges & Brokerage Concerns
7eba56ca-5a46-4c9b-88a5-a3d3941339b5,2025-11-29,Anonymous User,2,22,"The brokerage rates are attractive, but the app has usability issues, instead if showing the dashboard after login, the app shows explore, in MF section, the executed orders do not show buying NAV rate and Units allocated. in Stocks there are more problems which cannot be written due to words limits.",17.97.2,High Charges & Brokerage Concerns
7d785673-fb73-47ee-ad4c-a5da094c2211,2025-11-28,Anonymous User,1,57,"Too late response in option trading.. Even after setting the stop loss at a particular price, it always exits later at a more lower price resulting in loss. And on top of that the hidden charges ..Resulting P&L shows different after the day and when the amount reflects it is always lower and then unnecessary deductions. There is always 200-500 rs difference than what actually should have been received deducted in the name of charges other than execution charges.",17.97.2,User Interface & Experience (UI/UX)
ebab396b-917e-4989-9c91-c9d53f335c38,2025-11-28,Anonymous User,5,0,Easy to use and no nonsense app for your investment. suggestions: Analytics available on web portal on stocks and Mutual funds could be great addition.,17.97.2,User Interface & Experience (UI/UX)
80610a95-68f7-41bc-8580-212114e9a7d5,2025-11-28,Anonymous User,1,0,pathetic trading chart on app fyers is the best.... complete waste of money don't know how reliable they in handling money,17.96.7,Technical Glitches & Performance Issues
a2cc1458-fc0e-44a1-8d5c-9b4d016a6565,2025-11-28,Anonymous User,5,0,good app easy to access and user friendly,17.96.6,Technical Glitches & Performance Issues
f31f3cab-7a2e-4c5b-87c3-256d5d91cc66,2025-11-28,Anonymous User,1,1,"unable to update / add andra pradesh grameena bank, as it has recently merged.",17.97.1,User Interface & Experience (UI/UX)
0eb75d52-e14f-4e67-95a9-db4acd064140,2025-11-28,Anonymous User,4,443,"Very good app,though there is one limitation, that is a 10 year section not available for mutual funds when sorting or viewing any individual funds chart,it is important since it gives more long term perspective,and I would suggest for it to be added.And currently very few bonds available.",17.97.2,Technical Glitches & Performance Issues
a8410ee7-7f10-48a7-8968-1330be5c4fcc,2025-11-28,Anonymous User,5,0,very easy to use for beginners. Everyone who starting investments or trading kindly download this app and go through Groww youtube channel .,17.97.2,User Interface & Experience (UI/UX)
e14c4600-d76c-4c2e-8e68-4db3a1382dbe,2025-11-28,Anonymous User,5,0,"I'm new to investing in Mutual funds and I never thought, investing in Mutual Funds will be so easy. I'm loving the experience of investment.",17.97.2,User Interface & Experience (UI/UX)
5cf7b086-e217-46f4-b8df-f2c308576a53,2025-11-28,Anonymous User,5,1,i love investing through grow it's so simple to use and every thing works smoothly. Payment process is also secured and instant.,17.97.2,High Charges & Brokerage Concerns
5d398854-5d63-4679-a3e8-f1bef60b79ca,2025-11-28,Anonymous User,5,0,nice user friendly interface and quick response,17.96.7,User Interface & Experience (UI/UX)
a13d1c35-4619-42a6-bd79-9d5b71386d39,2025-11-27,Anonymous User,5,0,good and without any bug using for long time,17.96.6,Customer Support & Service Quality
c8bb6e63-3d60-4972-b30b-ac146da44ca7,2025-11-27,Anonymous User,5,1,"Best experience overall! But I faced one issue - I bought 3 stocks and tried paying via Fampay UPI but the payment didn't go through. Also, the brokerage charges feel a bit high even when I get ₹2-₹3 profit, ₹10-20 gets deducted, which is frustrating. Please fix this issue, otherwise Groww is really one of the best and most user-friendly trading apps!",17.90,User Interface & Experience (UI/UX)
8b4264e3-9d46-4a6f-8843-c175e6b1ba21,2025-11-27,Anonymous User,4,0,"Holding a sum of money is very unnecessary wrong calculation, otherwise no problem for me.",17.97.2,User Interface & Experience (UI/UX)
4a976f3a-12f9-43bb-b972-c3339977a670,2025-11-27,Anonymous User,2,0,"Using is more friendly than all Investment & trading apps, but your charges are soo costly",17.97.2,User Interface & Experience (UI/UX)
b1c836e4-79a2-487b-8a9d-d84ecdc0d64d,2025-11-27,Anonymous User,5,0,it's a very good app which is very easy and every one can do trade with this app 👍,17.96.7,Technical Glitches & Performance Issues
5aac0690-2eb2-463e-bfe4-17d4175f8bd1,2025-11-27,Anonymous User,5,0,"Ultimate App, one suggestion - When we want to place the order plz show the exact Amount and point Mover also want Chart on the same Time- (Ex - Share.market)",17.97.2,User Interface & Experience (UI/UX)
62eedcc1-e346-4328-a1a8-3e35bc59682e,2025-11-27,Anonymous User,4,67,"Showing events in single place is a great update. One suggestion, it would be nice to be able add & edit notes in MF/SIP, since everyone might have a reason for joining each SIP. Also, along with 52 week prof, dividend would be a good reference.",17.97.2,Customer Support & Service Quality
ffe15a06-8934-4271-87f0-509eeb3b3a7c,2025-11-27,Anonymous User,1,0,When I raised a complaint they said uninstall the app and reinstall. Will the loss recover while doing so? then he/she had no words.,17.97.1,User Interface & Experience (UI/UX)
450fdfc7-af68-4e75-812d-19ca51d26767,2025-11-27,Anonymous User,1,21,Why trade value of stock is not added in mobile application as it is present in desktop version even though their is proper space for that. I would like to request to add that small feature in mobile version so that I could change my rating. I'm not asking for much technical features I just want a feature which is already present in Groww. Hope this would be helpful for other users as well. I would be waiting for your response.,17.97.2,Missing or Requested Features
5bb4f63b-a218-4210-9000-97f35f89a661,2025-11-27,Anonymous User,5,0,"nice features , one of the best brokers for all the things you want to do from trading to mutual funds.",17.97.1,User Interface & Experience (UI/UX)
01af28e0-c586-4088-9f0f-1df6d0f84b95,2025-11-26,Anonymous User,1,0,one of the kachra for treding platform don't use always leging chart in this apss I contact customer care but not help,17.96.6,User Interface & Experience (UI/UX)
31975c3d-6634-4bff-b88e-32c45234b094,2025-11-26,Anonymous User,1,0,"charges is more for trader don't use this app please another one and also there no customer care is good, so please don't you this app",17.96.6,Technical Glitches & Performance Issues
f5cce232-f329-42dd-92c4-170a4d218ef4,2025-11-26,Anonymous User,5,0,"Easy and simple...groww is one of the simplest broker app, easy to add & withdraw money as compared to other brokers",17.96.7,User Interface & Experience (UI/UX)
d7613114-0343-4120-bf7c-e8c94a4fdc25,2025-11-26,Anonymous User,4,6,"Like in the Dhan app, when you add a stock to the watchlist, the price should be saved there so that in the future you can know what the price of that stock was when you added it to the watchlist.",17.96.7,Customer Support & Service Quality
f8be36d1-5e6a-488b-b8b8-5111818f4031,2025-11-26,Anonymous User,5,0,Good interface easy for beginners,17.96.7,Customer Support & Service Quality
c4e2b251-99bc-48f5-a1fd-d505e57b197b,2025-11-26,Anonymous User,5,0,Bank ledger required in app where all payment and received shows at a glance if it is there please inform,17.97.1,User Interface & Experience (UI/UX)
b8efad12-227f-41cd-bc0f-114874fbff25,2025-11-26,Anonymous User,1,4,Facing 2 big issue 1. When groww stock go down . This time groww app block buy & sell all . 21.11.25 9:30 AM groww stock down side 10% & blocked my all accounts for buy / sell & editing stoploss. 2. Same time not place Target price & Stoploss 😆 select only any one 😆 Go with 👉DHAN ALL of avilable. Order type Super Order.,17.97.2,Customer Support & Service Quality
c94f7c2e-7b9d-4829-961c-612d18e7d2fa,2025-11-26,Anonymous User,5,48,Groww is best of all trading apps that I have as of now. It has awesomely supported me in my trading journey so far. I will definitely support it to anyone without hesitation.,17.96.6,Technical Glitches & Performance Issues
f3c3c8f3-da53-40bc-ad91-ce77b08cb508,2025-11-26,Anonymous User,5,0,"best user friendly interface, that eye button in the holdings tab is the best thank the ui ux designer who did that on my behalf.",17.97.1,Missing or Requested Features
df073bf0-6419-4415-afb5-119901788f64,2025-11-26,Anonymous User,1,0,Why does it take immediately to add money and take various steps to withdraw the same amount the processing is too long and we need to wait for approval for 12 hr to withdraw makes no sense,17.96.7,Missing or Requested Features
f7569a36-10c1-476e-8170-a96bb33de7ca,2025-11-26,Anonymous User,5,0,Opinionated and intuitive for the first time user. Would be complete if there were an option to bid on GSec's.,17.96.7,Customer Support & Service Quality
8e5ab6ce-6109-46d4-b434-f630440cab1a,2025-11-26,Anonymous User,5,7,"Dev team, you must ask confirmation when we're enabling/disabling a certain feature. It is very annoying to have clicked some buttons accidentally causing unintended activation of services. It seems intentional and is in poor taste. Please have this fixed.",17.97.2,Customer Support & Service Quality
1e467a45-5f73-4bd7-af88-e761dd67786b,2025-11-26,Anonymous User,2,1,"really disappointed nowadays, because of crashing app memory and stopped working ,last few days when I want to book profit it crash again and again and show app memory crash ,if this happen along ,I really not want this app anymore",17.97.1,User Interface & Experience (UI/UX)
41c5aa39-153b-4924-9c19-18a4625caacd,2025-11-26,Anonymous User,4,2,very good and easy app. Deserves 5 stars but app font is very small. Small font of app is confusing every time. Please update app FONT. Font......font......font.....font,17.96.7,User Interface & Experience (UI/UX)
b24d63bc-1cc3-497b-8314-ef9fdecdb9b9,2025-11-26,Anonymous User,1,2,no one download just now I cancel my option positions they are close that so I loss many amount in this trading platform please give all of negative review,17.96.7,User Interface & Experience (UI/UX)
d59c8bfe-7852-445b-b640-2e52cb470832,2025-11-26,Anonymous User,5,0,Very easy and understand and very simple method,17.96.6,User Interface & Experience (UI/UX)
a8f32429-d04f-4188-a9b1-f58a7ed10c64,2025-11-26,Anonymous User,3,0,"Groww needs to seriously improve its Option Chain. For option buyers, it’s still very basic and cluttered. Important data like Overall PCR, Volume PCR, Total OI lakh value, Change in IV, Max Pain automatically calculate strike, and India VIX is missing. Everything is scattered — we need a clean single-screen view with all key data visible at once. Please upgrade the option chain urgently, it’s far behind Zerodha and Sensibull.",17.97.2,High Charges & Brokerage Concerns
2b525ef1-f3f7-43ff-bc3d-857f041f9f9f,2025-11-26,Anonymous User,4,11,"Please upgrade your groww chart (1-Tap Scalper Mode), very difficult to add or remove any tools lines, trendline etc, also need to add more indicators (Pivot Point Standard) for which many times I talked to customer care, raised ticket but not added yet. I must suggest, instead of groww chart, add 1-Tap Scalper mode to normal Trading View Chart...like Dhan App, you can take the reference.",17.97.1,Technical Glitches & Performance Issues
ce7f7d84-de6e-4408-9e73-0218ce44ac3e,2025-11-26,Anonymous User,5,0,Best app i have ever seen ! The interface and things are very attractive and effective 🔥,17.97.2,Customer Support & Service Quality
920de963-46ca-44c8-a8a3-5d50905e233b,2025-11-26,Anonymous User,4,1,Great app to use. Requesting the product team to include Weekly and Daily SIP options in the next application update.,17.97.2,User Interface & Experience (UI/UX)
5d713267-b527-477c-b231-d5622239a06a,2025-11-26,Anonymous User,1,1,This is a bad app. It charges a lot of brokerage during trading dhan and angel one is better option for trading.,17.97.2,User Interface & Experience (UI/UX)
6ff440c1-5ab5-445e-afc7-fd36f2b74b5c,2025-11-25,Anonymous User,5,0,Groww is best trading app very fast service for order in trading,17.96.7,Customer Support & Service Quality
36eee83c-6fdc-4016-89cf-e7908a667367,2025-11-25,Anonymous User,1,0,Pathetic company and worst customer service. So many hidden charges. Profit shown incorrectly and charges are way too much. Squared off shares without consent. So pathetic.,17.96.7,Missing or Requested Features
74fd6637-c202-43c4-bc1c-51f773c9c10f,2025-11-25,Anonymous User,1,3,"This broker changes its interfense frequently, and indicators are also rarely available, Trend Time Auto रिफ्रेश नहीं होता खुद करना पड़ेगा,, दूसरा कोई भी broker isse achha hai",17.97.1,User Interface & Experience (UI/UX)
d5b58dc9-dbcc-4635-8b04-708e07817e08,2025-11-25,Anonymous User,5,1,"Groww has proven to be an exceptional trading platform, offering consistently smooth performance across all segments. Its clean, intuitive interface is particularly valuable for fast-paced activities like option trading and scalping. The platform's ability to maintain a simple user experience while delivering powerful features makes it a reliable tool for traders. Everything feels snappy and the indicators are super easy to apply. I love having that level of detail right on my screen.",17.96.7,User Interface & Experience (UI/UX)
ca2da266-1c5a-4731-8c3b-b1e4717e51ba,2025-11-25,Anonymous User,5,0,Very easy to use self learning app.,17.97.1,Customer Support & Service Quality
e77e6d8a-3af8-4c29-ad0d-fcaef92c57fa,2025-11-25,Anonymous User,5,1,best app. no problem ui. user friendly. Overall good experience till now !!! 😄,17.96.7,Customer Support & Service Quality
2ec51ee2-b0f3-491c-b8e4-eb43ceec6b10,2025-11-25,Anonymous User,3,3,"Easy to Use for investment like ipo and share, not user friendly for trading in F&O. Also Very High brokerage changes than other platforms.",17.96.7,User Interface & Experience (UI/UX)
69adda82-2656-4d52-8225-ed989cb3c9c2,2025-11-25,Anonymous User,5,3,it was a wow experience while registration on the app.... everything was smooth and clear. today on 25 November it's been just 3 days but the experience is 👌,17.97.1,High Charges & Brokerage Concerns
f7d33a6e-cc5c-449c-82e1-7c2464e1072f,2025-11-24,Anonymous User,5,0,The interface is much simpler than other apps,17.97.1,User Interface & Experience (UI/UX)
7a675dd2-ccc8-4d1b-9445-2aa2d648b7b5,2025-11-24,Anonymous User,1,2,this application is not working 😭 properly today I used the application the rvnl share has gone or still showing 328... approximately but the amount showing 324 what is the behaviour and the share is showing on profits but after some time showing profit etc,17.96.5,Customer Support & Service Quality
c1c7fa77-8d6e-46aa-9fc4-f10b0435a699,2025-11-24,Anonymous User,5,214,I seriously think opening an account with Groww was this easy. A clean and smooth UI and hassle free process - all up and running in half an hour. Even the app is so smooth and easy to navigate. Adding funds was also super smooth. Totally recommend it.,17.96.6,User Interface & Experience (UI/UX)
2d793349-453b-4c30-bf5b-981a48251976,2025-11-24,Anonymous User,1,22,"Reasons for low rating 1. Top Mutual Fund invested info in the stock is missing - fixed thank you Edit 2 22nd Mar: 2. Why do all Indexes like Nifty smallcap 100, Nifty PSE, and Nifty microcap 250 are not shown in the app under indices section? Edit 3 24th Nov - Can we have an option to view family accounts, I keep logging out from one account to check the other?",17.96.7,Missing or Requested Features
e3109c0b-cf24-4d95-99c7-5de6ee586a01,2025-11-24,Anonymous User,1,1,"Too much glitch, option chain not open properly sometime working sometimes not working. Feel very bad with customer service center.",17.96.7,Customer Support & Service Quality
8f721f6b-cc43-427e-99f4-f3bc294a6b95,2025-11-24,Anonymous User,5,0,so simple.... if it's in mother tongue language then it feels mother teaching 😊.. I advice all stock or investors must use this to manage money... look after their money😅,17.96.7,High Charges & Brokerage Concerns
e6674916-21e3-4c53-8c69-8ffa6f8f6efe,2025-11-24,Anonymous User,5,0,The right app to get started with your portfolio!,17.96.7,User Interface & Experience (UI/UX)
cb01d1ff-5aaf-4969-a2bd-a53eb1926334,2025-11-24,Anonymous User,1,0,Giving one star as app don't have basic functions like sort to stocks positive to negative.,17.97.1,High Charges & Brokerage Concerns
2aaefd8b-8907-4e98-b280-07de45724ebd,2025-11-23,Anonymous User,5,0,Transaction are transparent and prompt,17.96.7,Missing or Requested Features
077d70e3-2ff1-4618-b5bc-56e5bb67238e,2025-11-23,Anonymous User,5,0,Nice interface and easily understandable,17.96.7,Technical Glitches & Performance Issues
07e8d54a-20b0-4475-a951-d7ae5300b416,2025-11-23,Anonymous User,1,0,The numbers are not visible. instead I see only 3 dots.,17.97.1,User Interface & Experience (UI/UX)
1e7260fc-809f-4524-8f1d-4cce7bc766d6,2025-11-23,Anonymous User,5,0,Very convenient platform for trading,17.96.7,Technical Glitches & Performance Issues
5fbe0494-35da-459f-9de5-2803d450d120,2025-11-23,Anonymous User,1,4,Guys your customer service is sooo worst from the past 3 days I'm dealing your customer care no. to related my mutual funds redeemable amount but not even single call is connected or picked by your respected agent. I'm harassed by you guys from the past 3 days i raise a ticket from your grow app but there is no solution,17.96.6,Technical Glitches & Performance Issues
fd77a3eb-3553-441b-b1c9-5647d0e77c22,2025-11-23,Anonymous User,5,0,"I ’ve been using Groww since 2021. After the latest update, the platform has become even more user-friendly and easy to use. Thanks — Groww sahi hai!",17.96.6,User Interface & Experience (UI/UX)
b0f5c80c-10dc-401f-a2fd-40b7574f7cc8,2025-11-23,Anonymous User,1,0,"Very bad ,when you want to help any issue.Customer care does not to talk.No support.high brokerage charge.many hidden charge.So guys If you want to save your money .Do not download this.No trailing Stoploss.",17.96.6,User Interface & Experience (UI/UX)
508de710-f2a6-4a6f-a1b4-099d0b0c53a1,2025-11-22,Anonymous User,5,0,Everything in this platform is very easy to use there is no laggy in any stage,17.96.7,High Charges & Brokerage Concerns
f4408a94-460d-479e-8d30-85e236631b4e,2025-11-22,Anonymous User,5,0,"very good app, in contract note brokerage details not mentioned against each order, please mention the brokerage against each order",17.96.6,User Interface & Experience (UI/UX)
cdfdec7a-deb2-4dd2-b86f-7ee26e4a0384,2025-11-22,Anonymous User,1,0,"Don't go for groww, use zerodha or something else, this application have many technical glitches Don't loss your hard earn money.",17.96.7,User Interface & Experience (UI/UX)
