review_id,date,user_name,score,thumbs_up,content,review_created_version,theme
8c3b4a87-e5e5-44f6-8c59-cc427704fdee,2025-11-16,Anonymous User,5,0,simple and at a glance view. Superb!,17.96.7,Technical Glitches & Performance Issues
2d04878a-4384-4ab9-8e19-d947d950d03c,2025-11-15,Anonymous User,4,42,"I think the app is really good and easy to use and recent Updates are amazing,But one feature should be added that There should be an option to see the company details in brief or in detail in app. This can have many things like its core business, its establishment, its parent company, etc. And charges you have increased are very unfair, one of which is DP Charges per sell order instead of DP Charges per ISIN Number (company). I found this very unfair.",17.96.7,User Interface & Experience (UI/UX)
feadbb8d-2b6e-4824-b981-a1de49ee6bbc,2025-11-15,Anonymous User,1,1,I m new in this field but i don't like this type of app demat account free bolke broker kitna paisa leta broker take very high charges very bad experience,17.96.7,Customer Support & Service Quality
0c786554-7c47-43e0-add6-43fcb31c3cba,2025-11-15,Anonymous User,5,0,"Very easy to invest..super,,please provide Trailing stop-loss in options trading and remove p&L from chart",17.96.7,High Charges & Brokerage Concerns
4338f429-d167-4d51-ad43-c81e389325d7,2025-11-15,Anonymous User,5,1,great better than angel one. so many option and graph showing us easy ❤️❤️,17.96.7,User Interface & Experience (UI/UX)
119c3430-08fc-47ac-9ca6-6cadf98f20e0,2025-11-15,Anonymous User,5,1,kindly add new feature in trade segment having index level as target and stop loss for example if you want to hold a ce trade then you can add index level as target,17.96.7,Customer Support & Service Quality
77380615-6323-4bbb-98ae-cb384aee7d21,2025-11-14,Anonymous User,5,25,I had an issue related to multiple charts which were not showing in the app .Groww resolved the problem within a few hours.Good service.,17.96.7,User Interface & Experience (UI/UX)
038fd5a0-ee06-4b04-b37a-a4c17d1919b1,2025-11-14,Anonymous User,4,1,Facing issue while connecting with wifi (personal n public both).asking to enter pin no again and again.,17.96.7,High Charges & Brokerage Concerns
7180d199-344b-45ef-ab31-eadce3781eaf,2025-11-14,Anonymous User,4,0,"good app for trading, everything is fine about grow app but brokerage is high than other trading apps so kindly reduce the brokerage amount to nominal price",17.96.7,Customer Support & Service Quality
a5d42695-bf24-4190-837e-f74d51832e27,2025-11-14,Anonymous User,4,1,"provide a filter in the watchlist also, rest all is good",17.96.7,User Interface & Experience (UI/UX)
e41ae397-6a47-48c6-af16-8b20e2757d0b,2025-11-14,Anonymous User,1,1,"too many technical glitches on intraday, mainly prices and p&l don't show properly",17.96.7,Customer Support & Service Quality
3c380ad3-4b14-4cae-9758-0c8e7ead8490,2025-11-14,Anonymous User,5,3,"pretty good for beginners, easy to navigate and provides most of the featured when compared to other such apps. Will highly suggest this groww app for beginners",17.96.7,Customer Support & Service Quality
2ccd6244-b354-4b93-b3bb-9159248ae5c3,2025-11-14,Anonymous User,1,1,"I had an issue in the Groww app, so I contacted customer care. But they haven’t responded yet — I’ve been waiting for the last 30 minutes with no reply.",17.96.7,User Interface & Experience (UI/UX)
866a52a0-bf3c-4270-8c87-5d4bc613ea9b,2025-11-14,Anonymous User,2,44,"I have been facing an issue with Groww for the past six months. They have held an amount of ₹15,000 of mine, and despite repeated follow-ups, the issue remains unresolved. Resolve this matter at an earliest I am extremely disappointed with the handling of my UPI mandate issue. An amount of ₹15,000 was withheld during a transaction, and despite repeated follow-ups, there has been no proper resolution or communication from the support team. It is frustrating when customers have to wait indefini",17.96.7,High Charges & Brokerage Concerns
e3aeca6f-7644-4607-a0e5-de1156781cf8,2025-11-14,Anonymous User,1,9,"third class service, not able to login in app, its only showing oops something went wrong everytime. Not able to trade because of this issue, causing losses.",17.96.7,Technical Glitches & Performance Issues
e2a52d04-a5e9-4266-86c9-63c55e40ec58,2025-11-14,Anonymous User,1,41,"This is a very bad app. It caused me to lose ₹20,000 in profit because it did not execute my exit order. I had placed the order, but the app failed to initiate it, and as a result, I missed my profit. Please explain what went wrong and why my order wasn’t processed",17.96.7,Technical Glitches & Performance Issues
9989f4f2-6553-4034-889f-c0c828b3f39e,2025-11-14,Anonymous User,1,5,"wish app. have some more features like, trailing SL, Straddle combined premium chart, OI, change in oi, max pain visuals. crypto also...",17.96.7,User Interface & Experience (UI/UX)
a90b94d6-9496-49ab-b766-5a8eac8de7b3,2025-11-14,Anonymous User,1,1,the ipo application process is so delayed and it stucks on upi approval process whether install any other brokerage app and customer service is very worst,17.96.7,High Charges & Brokerage Concerns
cab50040-09d6-4499-aa41-f960886e30c6,2025-11-13,Anonymous User,5,1,Best and wonderful interface and easy activities. Having a good Experience. Thank you.,17.96.7,User Interface & Experience (UI/UX)
66db8b04-b8bd-4b09-a040-481398d21c55,2025-11-13,Anonymous User,1,184,"I have faced an issue while converting my intraday to delivery. The application said you have sufficient balance but there is an error for the conversion. I couldn't convert and they deducted the roundoff money. I have contacted the costomer care but they said, I didn't have sufficient money for the convertion. that is, we need to pay for their errors too. I had screenshots but no reply, nothing....",17.96.7,Technical Glitches & Performance Issues
9720623f-de4d-41ab-b1ae-402a3cbb3231,2025-11-13,Anonymous User,5,130,"Of late, Groww has introduced trading on charts. The 9.15 terminal is good indeed. Now, the only requirement is to bring the kill switch in the next update. Eagerly waiting for it.",17.96.7,Technical Glitches & Performance Issues
bd983472-1c0a-4722-9731-2b94cea4e47d,2025-11-13,Anonymous User,5,0,"Very Good App between all Brokaer app , I wish grow introduce pre IPO mandates because some time I am not able to approve mandates due office time. so I think one more option like introduce from groww for pre approve mandates when mandates come between bank time 10 AM to 5 PM then mandate auto approve which I am already approve. please Do some thing for pre approve mandate for IPO.🙏😊",17.96.7,Missing or Requested Features
09af5134-053f-410d-a405-a663331ed949,2025-11-13,Anonymous User,5,2,"simple ,safe ,and fast process ,best app for trading",17.96.7,Technical Glitches & Performance Issues
6d63bdc5-c2ff-4e26-ad7a-e80a69acdadc,2025-11-13,Anonymous User,5,0,Good very nice app but in tool are very less available,17.96.5,Customer Support & Service Quality
c864eb07-b263-49e4-8c04-1820e7920de9,2025-11-13,Anonymous User,5,1,The UI and the overall presentation is so good!,17.96.7,User Interface & Experience (UI/UX)
aa88ccb2-9aae-4481-bd46-42b8c47393ac,2025-11-13,Anonymous User,5,2,"Most important about this app, is very easy to understand all info, so that even a new user can also handle it",17.96.7,Customer Support & Service Quality
97c58e69-baf4-4029-80d3-ea8d8d25b606,2025-11-13,Anonymous User,5,0,An excellent application for regular trading activities,17.96.4,Customer Support & Service Quality
eb017dfe-3d0e-4494-975c-7564d04dd87d,2025-11-13,Anonymous User,4,0,"Good. Please allow the investors to group the funds under categories like Retirement, Education and so on.",17.96.7,Missing or Requested Features
4d49f0f1-e35c-4afa-8aeb-e8e198a54635,2025-11-13,Anonymous User,5,0,Suggestion: Can you guys add widgets for Mutual fund holdings similar to thats of stocks one we got now!,17.95.2,Customer Support & Service Quality
51329321-68e2-4262-af36-f5cf3bc38861,2025-11-13,Anonymous User,5,0,The grow interface is so good...it getting better day by day....need a KILL switch to stop over trading.....,17.96.7,User Interface & Experience (UI/UX)
f090c2e4-d7c1-4055-b485-a29fd35900a0,2025-11-13,Anonymous User,1,1,"After entering pin it's showing ""you are not allow to perform this task, kindly check after some times"".",17.96.7,Customer Support & Service Quality
a24b148d-e118-4a93-8865-76bb075d6614,2025-11-13,Anonymous User,5,47,I am using this app since january 2025. Interface of this app is pretty good. very simple UI and easy to Navigate to any option. very smooth app. I will recommend this app to my friends and family.,17.96.7,Technical Glitches & Performance Issues
2bff1406-b95e-4565-b2ad-344d20f0d653,2025-11-13,Anonymous User,5,0,Best ever platform for beginners.,17.96.7,User Interface & Experience (UI/UX)
de8d7306-dc8a-4a2d-a013-4ac5b80ec9a9,2025-11-13,Anonymous User,1,1,"recent days, groww has hidden the split of other charges and taxes section. and looks like hidden charges applied. as I can witness there's huge difference in charges earlier and now.",17.96.3,User Interface & Experience (UI/UX)
dbf1d997-77c8-4805-9277-7990416bcd0f,2025-11-13,Anonymous User,5,1,Excellent app. Sale one stock and purchase another instantly. Bid any mutual fund before 1pm and get NAV of same day.,17.95.2,User Interface & Experience (UI/UX)
6d1d5fc5-e6fa-4b18-a5f0-13da70f87e20,2025-11-13,Anonymous User,1,5,"worst app, very high brokerage and charges. a big part of profit earn in intraday take as a brokerage charge. keep retail investors like us loss the hard earn money. intraday is not playable with this platform. this app like betting app. 1 will earn and others are loose the money.their is no perfect parameter to analyse any stock.please put the financial parameters that actually work.",17.95.2,Technical Glitches & Performance Issues
7637cda7-fc46-41c6-a7dd-b044c4ee100c,2025-11-13,Anonymous User,1,15,"Hi, availed LAMF and after part withdrawal from account total outstanding amount is showing correct balance plus 5 times excess of the withdrawal amount. Followed up with the support team, grievances dept, nodal officer, app nodal officers, no one bothered to respond and rectify the issue. Now almost a month has passed, no solution. Customer support staff ""CALLED AS CHAMPIONS"" , behaviour is very pathetic. and unprofessional. No one bothered to respond.",17.95.2,Customer Support & Service Quality
ca4f71d2-3ae6-4aa4-a48a-bc9643ee8154,2025-11-13,Anonymous User,1,5,Don't use this app if there is any chance you are going abroad in future. Because they don't support investment for NRIs. You will get stuck with your existing investments. They also don't read the review and reply with automated response.,17.95.2,User Interface & Experience (UI/UX)
e8a9fd2e-3164-4e6f-8347-72fbefb19e49,2025-11-13,Anonymous User,5,0,Grow is Best App Geniune I am Trusting on Groww App is more Helpful in my Bad or Financial Situation Thanku Groww Keep it up Pls Add on the Crypto Exchange Facility,17.95.2,User Interface & Experience (UI/UX)
71f66cb5-768d-4f19-a7f2-5e0eff062fda,2025-11-13,Anonymous User,5,2,Best and Easy Platform for Trading. No glitches. Smooth and Fast.,17.96.7,User Interface & Experience (UI/UX)
aa3a7fb6-2b41-4640-a58e-2a2d925b984e,2025-11-12,Anonymous User,5,0,number one trading app for all options like mutual funds and everything very good experience,17.96.7,User Interface & Experience (UI/UX)
6051f635-5fc5-435c-b720-6e4a5d8d42ba,2025-11-12,Anonymous User,5,2,it's very amazing to use the grow app. All stocks and mutual fund information are very helpful.,17.96.7,User Interface & Experience (UI/UX)
3fc66626-56a5-4f56-bc32-dd1c1f7c4967,2025-11-12,Anonymous User,1,1,I have not seen a worse app than this till date. It would be better if people uninstall it. SL trigger has no meaning. Those who want to lose their money should use this app.,17.95.2,High Charges & Brokerage Concerns
83f4fe98-529f-42b6-af9c-7d57acc07a16,2025-11-12,Anonymous User,1,2,"worst ! customer care is filled with literally fools , even onboarding is worst. A joke of the application. -ve rating is what they deserve. I got ticket opened where there was absolute zero support, grievance mail id is also kachra. EDIT :: mail was done already and response was pathetic despite follow-ups and ticket got closed. issue still exists - ticket id - 23240440. Edit : no action was done, hence uninstalling this useless application having careless bunch of jokers who wastes time",17.95.2,User Interface & Experience (UI/UX)
359da516-c1bc-42e5-9e2f-8e702972683e,2025-11-12,Anonymous User,5,2,This app is very good and all the features are nice but you can make loss in share market along with profit and the chances of loss are high.,17.95.2,Technical Glitches & Performance Issues
f7ec6414-ee8c-457d-b593-d67245dbd8d6,2025-11-12,Anonymous User,1,2,Not working at price and candle moving comodity option chain proper note price work,17.96.7,Technical Glitches & Performance Issues
db4680d8-7304-4d96-a517-541a7ada1310,2025-11-12,Anonymous User,5,0,All Features Are Excellent Performance.🌟🌟🌟🌟🌟,17.96.7,High Charges & Brokerage Concerns
8b24bb73-42d7-4c7c-81c7-9299c7ce5d08,2025-11-12,Anonymous User,3,6,app is good. but chart and prices especially strike prices take time longer than usual to refresh.... interface is good and simple. pls improve in above addressed issues..,17.96.7,User Interface & Experience (UI/UX)
9d162bb3-230c-4451-a718-12232e54bd2e,2025-11-12,Anonymous User,5,0,great and smooth app for use . this good app. my ipo is not allotted. I have purchase share but share prise is high,17.96.5,Customer Support & Service Quality
8d81989a-da73-40b6-937e-d56ca5f375a7,2025-11-12,Anonymous User,1,703,Really disappointed been using the app from almost 8 months initially the app was very good but now its buggy like hell every other day cannot place orders. When placing order in intraday it place order really late and sometimes even after 20 mins order pending and when the place the order already miss on profits. Even today market is open from 15 mins and still can't place new orders really getting in my nerves now. If you guys keep on going like this wont take long for people to move to others,17.96.7,User Interface & Experience (UI/UX)
15c4d633-5676-45b1-b1f5-57e42096fb6e,2025-11-12,Anonymous User,4,154,"My experience is good on this app. I have just one suggestion - if you buy and sell the shares the same day and then again buy the same shares again the same day, the average price shown is average of all the trades. Instead of this average price shown, the new bought price should be reflected that will help to make decisions more precisely.",17.95.2,Missing or Requested Features
a5b2327b-ed8a-4ca7-bd84-9e9bf128c4ac,2025-11-12,Anonymous User,5,2,good but freezes at times hence had to open an account with upstocks. Ui is much better than upstocks and easy . if lagging issue is fixed during market hours will be really great .,17.95.2,Technical Glitches & Performance Issues
eafc1bc2-9d90-498b-ad38-bb3f8c42669a,2025-11-11,Anonymous User,1,1,unnecessarily asking for money and not showing proper options or steps to sell the stocks. I made loss because of them.,17.95.2,Customer Support & Service Quality
5965b963-9a48-4f61-83e0-66ce674f07bf,2025-11-11,Anonymous User,5,0,all update is supper.but i update very long time .i am not show update.friends show imidietly.why.not show option greek in option chain in my grow id.10 november after update not show,17.95.2,Missing or Requested Features
2c85fbc6-731f-4148-a426-29f3ed03214c,2025-11-11,Anonymous User,5,0,"Great UI experience unlike other competitors. Very intuitive, quick & easy to find information for investment",17.96.3,Missing or Requested Features
509afce1-841a-4851-9ed7-dcdd1d3d2412,2025-11-11,Anonymous User,1,4,"Account activation in progress for a month, already sent multiple mail. just a reply please stay worry free.. nothing else. edit: sent mail with ticket , still no response , only automatic email. we are working hard .. what hard ?",17.95.2,User Interface & Experience (UI/UX)
b6767208-ba67-482b-8cfd-92a050886d4c,2025-11-11,Anonymous User,5,6,very smooth app.. But brokerage of MTF and MTF interest rate is very high. rest everything is good. MTF rate should be levied as per pre defined slabs. and brokerage should also be reduced.,17.95.2,Customer Support & Service Quality
af93dc3a-5958-4b95-84b8-40f3274b0de5,2025-11-11,Anonymous User,4,0,"Redeem money credited in bank accounts taking too longer this is really such embarrassing, try to resolve it kindly that will be helpful",17.95.2,Technical Glitches & Performance Issues
f21b8666-3240-4c18-8a93-9402a75dbab0,2025-11-11,Anonymous User,4,0,"Dear sir, my family has , 5 demat account for investment and ipo. pls add multiple accounts adding feature in groww app like Dhan app. I have very tied for login or manage account.",17.96.7,User Interface & Experience (UI/UX)
c653cfe3-7d81-463c-9255-749b66a6b217,2025-11-10,Anonymous User,5,0,"this is really best platform to trade, grow also tells us which sector is making high , which stocks are low. it's amazing application",17.95.2,Customer Support & Service Quality
feaf3297-1f26-483d-b95e-ec18ebc2e240,2025-11-10,Anonymous User,1,4,"groww platform loosing trust of trader's Order Execution Delays/Failures: Users have reported instances where ""exit all position"" features or simple sell orders do not work immediately and remain in a queue, leading to missed opportunities or losses.",17.95.2,Technical Glitches & Performance Issues
4b2a98ba-4e3c-4e78-a40b-c6b7b8e3f138,2025-11-09,Anonymous User,5,12,very easy to use and really far more better than any other broking app the interface is so easy to use and client friendly really enjoying using groww app and waiting for more interesting updates for the app.. :),17.96.3,User Interface & Experience (UI/UX)
8f7f1e0e-9ab4-493b-8121-0d556f19f61f,2025-11-09,Anonymous User,4,322,"Everything is so so good about your app except one thing- it's speed is slow and sometimes it gets hanged, or the prices are not getting refreshed...This problem is persistent since the last 2-3 weeks...Or else full marks on everything else- it's super user- friendly, easy to use and trade!!",17.95.2,Technical Glitches & Performance Issues
cf48252a-9ef7-401a-899a-63144d5f9534,2025-11-09,Anonymous User,5,1114,"Couple of issues that can be addressed. Many brokers allow the details of the trades along with the charges to be downloaded in the Excel format for uploading the data to another Excel sheet maintained by them. Groww needs to work on this aspect. 2. when I transact, the rate given on the screen is seemed to be higher than prevailing rate if a buy is being placed and similar for a sell transaction. I would like a situation where the rate on the screen is blank and filled by the trader.",17.95.2,Technical Glitches & Performance Issues
3e7c6896-74cf-4d17-b9da-0d14cb039620,2025-11-09,Anonymous User,5,0,Totally bad . After use of more than one year .... Refund issue long than one month and auto deduction of SIP. All are creating problems,17.96.2,Customer Support & Service Quality
a561e04a-5877-4e31-91c0-3775b2c5713f,2025-11-08,Anonymous User,1,4,Chart settings become worse. earlier it was user friendly and now it is very complicated and I don't see proper options to explore,17.93.2,User Interface & Experience (UI/UX)
6262bf4a-9332-469a-86de-f704b3a02ae0,2025-11-08,Anonymous User,4,75,"In your application, when we add indicators or drawings to charts, they get saved initially. However, when the app is reinstalled—either on the same phone or on a different device—the previously saved indicators and drawings disappear. I sincerely request you to introduce an update that ensures all chart indicators and drawings remain saved and synced, even after reinstalling the app or switching devices.",17.96.4,Missing or Requested Features
7f341376-b77d-4a69-95c4-122074086c41,2025-11-08,Anonymous User,1,8,"In Groww app specifically in commodity market's position bid for target can be set 1 point above or below w.r.t.CMP or you can exit at market price. It is very problematic in case of NG even points in decimal matter so please set this so that we can set bid price even in next decimal point. eg. if NG bought at 385 reaches 386.4 and I set bid at this CMP ,it accepts only at or above 387.4 only and price fall again from 386.6 ,so please fix it so bid can be set at desired next decimal pointsThanks",17.95.2,Missing or Requested Features
d377d39c-4ee0-4f69-aa75-0a4823edd700,2025-11-08,Anonymous User,5,0,The customer service team is doing excellent work... prompt response towards my query.. app is also easy to use... user friendly,17.95.2,Customer Support & Service Quality
3a27f7e3-dea0-468d-b12f-f249c80adc09,2025-11-07,Anonymous User,5,4,lot of bugs while trying to close the demat account. had to reach customer support for closing the account and yet I see some glitches after closing the account. update : it is resolved now.,17.95.2,User Interface & Experience (UI/UX)
7b9848d8-5b3f-4c13-a2c8-96e429d8e778,2025-11-07,Anonymous User,5,0,Easy ah simple ah iruku. Safety and quick transaction. Best app,17.95.2,User Interface & Experience (UI/UX)
bb40429e-660c-429f-87ea-e93b9150e5db,2025-11-07,Anonymous User,5,0,This is the best app for Investment because First of all it's free and secondly it has a very user friendly interface in the app.,17.95.2,Customer Support & Service Quality
cb7b36a7-377d-45b5-b1bc-a1fa94872ad0,2025-11-07,Anonymous User,5,0,User friendly and reports. No support from advice for investment aspects,17.95.2,Technical Glitches & Performance Issues
581cdbb7-68c9-422c-af1d-3f76b47847ec,2025-11-07,Anonymous User,1,2,Works well so far but improvement is required. We need new widgets that allow us to track options from all markets.,17.95.2,User Interface & Experience (UI/UX)
a544af53-c8f0-4d74-82ea-e277d1e005ea,2025-11-07,Anonymous User,1,1,very bad experience and brokerage is so high I don't like this app and if you trade this app brokerage taxes is very high,17.95.2,User Interface & Experience (UI/UX)
d285b5c7-cc44-4e96-83a7-18c546dfe40d,2025-11-07,Anonymous User,2,17,Optimize the app according to tablet users also.. as in tablet landscape mode is not working properly,17.95.2,User Interface & Experience (UI/UX)
9319f362-6edd-4280-ae7f-9b50a75ce7c5,2025-11-07,Anonymous User,5,1,it's a nice and very easy graphical user interface anybody can easily access,17.95.2,Missing or Requested Features
c027a8bf-e9ff-44b6-ae4b-b0311d673099,2025-11-07,Anonymous User,1,4,very worst application please don't install if you cancel the sip they will process the sip and you need to bare a bounce charges also they will get some persentage amount from the bank. if you start a investment they will process with in 24 to 28hrs but if you cancel the investment it will take 7 to 10 days please don't install,17.95.2,Customer Support & Service Quality
6bf87f92-c7b7-4977-aafd-c43d12e19b15,2025-11-07,Anonymous User,1,6,I am changing my previous review from 4 star to 1 star anyone using f&o don't use groww. The platform doesn't take stop loss orders and even if it does it doesn't get properly squared off Ticket no 23462828,17.96.3,User Interface & Experience (UI/UX)
0aefcf90-30da-4b50-a37a-85b5f2c7991e,2025-11-07,Anonymous User,1,3,after a mtf Trade groww shows my balance in 69 thousand in negative instead of showing my original balance with profit i gain. i tried to contact customer care but after so many attempts call didn't connect. this is pathetic service i ever face. very bad experience,17.96.1,High Charges & Brokerage Concerns
81d97fb9-7d6b-46be-b51c-91f10f962052,2025-11-07,Anonymous User,5,2,Great app. can you add a separate tab for ETF investment like mutual funds. Right now its shown with stocks so hard to calculate both profit.,17.95.2,Missing or Requested Features
60a106b7-f0af-433f-a618-ed11b178a71c,2025-11-07,Anonymous User,4,0,It's good for investment but needs some better offers like extra credits for customers with timed investment ....,17.95.2,Customer Support & Service Quality
e869bf32-86eb-45fc-bd56-f09101c25bd2,2025-11-06,Anonymous User,3,7,From when it started taking triple fees for every purchase then early year... It will fail for many people very soon.. please reduce fees as there are also many persons who have less money ..CUTTING 65 ₹ MIN. for every sell... early this year was ₹20 which was good... DON'T BECOME GREEDY GROWW,17.95.2,User Interface & Experience (UI/UX)
843506fc-dfa2-4e44-a582-7fcea27e7d06,2025-11-06,Anonymous User,1,3,"Today I tried investing through this app, and honestly, it’s a complete disappointment. I sold stocks worth ₹168.58, but after all the deductions, I received only ₹20.59 in hand! 😡 They deducted ₹147.99 as charges, taxes, and brokerage, which is just ridiculous. No matter how much profit you make, everything gets eaten up by these charges. This app is absolutely not user-friendly — it just keeps cutting hidden charges.I’ll never use this useless app again in my life, and I’ll make sure no one",17.95.2,User Interface & Experience (UI/UX)
a8b254ec-2221-45a1-b2b5-df5847759071,2025-11-06,Anonymous User,1,13,please use any other apps... This app will trap you in big lose... faulty system procedure will create money loss. Based on my experience. this is not reliable trading platform. Order stop loss Target are not working properly. Huge loss will happen to traders...,17.96.4,User Interface & Experience (UI/UX)
8c61251a-a5ac-4256-b044-2e80ce93b822,2025-11-06,Anonymous User,2,4,Question mark ❓️ symbol is showing in previous close price and open price. I think UI testing has not done properly. UI interface is not looking good..,17.96.4,High Charges & Brokerage Concerns
